{
  "version": "0.1",
  "id": "ctx-allow",
  "timestamp": "2026-01-15T08:45:02.245140Z",
  "request": {
    "method": "POST",
    "path": "/api/license/activate",
    "routeId": "license.activate.v1",
    "headers": {
      "content-type": "application/json"
    },
    "contentType": "application/json",
    "body": {
      "present": true,
      "sizeBytes": 120,
      "sha256": "aaaabbbbccccdddd",
      "json": {
        "redacted": true,
        "sample": {
          "tenantId": "tenant-1",
          "licenseKey": "***",
          "deviceId": "dev-1"
        }
      }
    }
  },
  "identity": {
    "authenticated": true,
    "tenant": "tenant-1",
    "subject": "user-1",
    "scopes": [
      "license:activate"
    ]
  },
  "client": {
    "ip": "203.0.113.10",
    "userAgent": "fixture"
  },
  "runtime": {
    "language": "node",
    "service": "quickstart",
    "env": "test"
  }
}
